text;topics;sentiments;date;rating;source;id;author;title;product_category;sentiment
"Совершенно издевательское отношение к клиентам, позвонившим на горячую линию Газпромбанка. Вопрос: для чего она существует, если стандартный ответ среди белого дня и посреди ночи один и тот же: "" В связи с большим количеством обращений время ожидания увеличено». Далее сообщается, что время это составит 30 минут. По истечении 30-ти минут (проведён «эксперимент») неведомое их количество будет повторяться одна фраза: "" Время ожидания составляет одну минуту». И так до бесконечности, наверное.

Такого нет ни в одном банке, к услугам которых приходилось обращаться.";;;02.09.2024;2;sravni.ru;20568;Валентина None;Отвратительная работа горячей линии;Другое;positive
"21 марта 2024 года окрыла дебетовую карту Union Pay по акции «Кешбэк 5000 рублей при соблюдении условия: поддержание минимального остатка на карте 50 000 рублей в течение 3-х месяцев»

Выпускала карту для поездки в Дубай. Карту привез сотрудник банка в 21 марта в 17.05, Выдал карту и сказал, что после активации карты, необходимо ее пополнить, с карты будут списаны 5000 комиссия, которая будет возвращена при выполнеии условия остатка на карте 50 000 рублей.

Карту банк активировал 24 марта, до этого момента пополнить карту ни в банкомате, ни переводом было невозможно. Пыталась сделать и то, и другое, также писала в чат банка с просьбой активировать карту, т. К. Приближалась дата отъезда за границу и очень не хотелось остаться без карты в другой стране. 24 Матра после активации карты, сразу же пополнила ее на 55 000 рублей и 3 месяца держала неснижаемый остаток. Никакой информации от банка о невыполнении мною условий не поступало.

После выполнения всех условий и не дождавшись кешбэка, обратилась в чат банка (уровень операторов это отдельная история и большая потеря имиджа банка), мне сообщили, что я не выполнила условия акции, 50 000 рублей нужно было внести в день выдачи карты и все.

А как, простите, его выполнить, если банк не активировал карту в день ее выдачи?

На мой этот вопрос оператор банка ответил: Вы не выполнили условие.

Газпромбанк, не \*\*\*\*\* людей своими акциями, берите 5000 в открытую и по-честному, Вы в первой тройке и с госучастием, не ждешь такого от государства.";;;01.09.2024;1;sravni.ru;20569;Елена Стоналова;Газпромбанк не возвращает 5000 руб при открытии карты Union Pay!;Повседневные финансы и платежи;positive
"21.08.2024 Г. Я решила открыть накопительный счет в Газпромбанке. После подписания договора начались звонки из банка со странным вопросом: «Вы такая-то такая (ФИО)?» На мой вопрос: «Что вы хотите от ФИО? И вы поверите мне на слово, что я действительно ФИО? » В ответ получаю: «Вы не прошли верификацию, мы свяжемся с вами в другой раз». В чем смысл таких звонков? Как вы собираетесь верифицировать человека по телефону?!
27.08.2024 Я обратилась в банк для отзыва согласия на обработку персональных данных с целью предоставления рекламной информации об услугах и продуктах банка. Которые были подключены мне без моего согласия, меня об этом даже не спросили, сами наставили галочек, что я согласна на их получение. Но даже после этого звонки не прекратились. 31.08.2024 Г. Я решила не связываться с банком, который не выполняет требование клиента, и расторгнуть договор с банком.
Техподдерка банка это вообще что-то фееричное! Вам сообщают: «Уважаемый клиент, ожидаемое время до соединения со специалистом составляет 30 мин.» После ожидания обратного отсчета до 10 минут, звонок прерывается и можно начинать все сначала. О каком уважении к клиенту может идти речь, заставляя его столько ожидать, а потом еще и отключаться?";;;31.08.2024;1;sravni.ru;20570;Ирина Мозолева;Неуважение к клиентам;Повседневные финансы и платежи - Ведение валютных счетов;negative
Заказал дебетовую карту! Написали приезжайте, забирайте! Поехал забирать, в отделение в Питер! Почти приехал, звонит человек, я мол курьер, карта ваша у меня, но я вам её пока привезти не смогу, только часа через 3-4, хотя время встречи указано с 10-15. Я ему говорю, а смогу я такую карту сделать в вашем отделении любом, чтобы не слонятся в Питере! Он говорит конечно! Я прихожу в отделение, они меня по компу видят, вроде начинаем оформляться и наступают тех. , Проблемы. И оператор говорит извините ничего сделать не можем, как-то так. Вообщем долгая история, не советую этот банк!;;;31.08.2024;1;sravni.ru;20571;Аноним None;Всё печально!;Повседневные финансы и платежи;neutral
"Решил оформить через банк автокредит. Пообщался с оператором, узнал все условия — ок. Назначали встречу с курьером 29.08 На 30.08. Сказали, что сегодня со мной свяжется курьер для согласования времени встречи. 29.08 Никто так и не позвонил.

30.08 Звонок от курьера, сказал, что приедет в промежутке между 15:00 и 18:00. В 17:48 пришло смс, что по техничским причинам встреча отменена. В ближашайшее время мне позвонит сотрудник банка и назначит новую встречу. Далее звонок от того самого курьера и он мне сообщает, что с документами какая-то проюлема и мне нужно самому приехать в офис. С какими такими документами проблема, если я никакие документы не отправлял и задача курьера как раз эти документы проверить. Если ваш 1 курьер на весь город не справляется со своей работой — так и скажите. Что за каменный век? Ехать самому в банк, когда все ваши конкуренты выезжают на дом для решения подобных вопросов.

Так ладно еще бы сразу сказали, что нужно ехать. Тупо просидел и впустую прождал. Почему о пробелме с документами сказали именно за 12 минут до встречи? А что с ними было вчера и целйы день сегодня?

Ужасное впечатление о банке. А, ну и дозвониться до банка не так уж и легко. 30 Минут мне потребовалось, чтобы меня соединили с оператором. Много обращений? Это не проблема клиентов, нанимайте больше людей. Я не должен висеть на линии 20 минут, чтобы просто переговорить с оператором. Треэш какой-то, хуже сервиса я лично никогда не встречал. Оператор двух слов связать не смог, на вопросы ответа нет. Сперва переназначили встречу, потом я сказал, что где гарантия, что встреча снова не отменится в последний момент?

И вишенка на торте: я сказал, что курьер отменил встречу т. К у меня якобы какие-то проблемы с документами (которые я не отправлял). После чего оператор сказал, что тогда мне нужно самому ехать в банк. Классно. Оценка 0 из 10";;;30.08.2024;1;sravni.ru;20572;Сергей Сапаров;Ожидание на линии составляет 2 млрд лет;Повседневные финансы и платежи - Мобильный банк;negative
Плюсов нет у данного учреждения! Одни минусы! Оператор которая открывала вклад в г. Самара ул. Победы 105 объясняла не внятно, запутанно. Не разрешила открыть два счёта по миллиону, назвала заниженные проценты, предложила вклад с выгодным предложением заверив, что через 6 мес наваримся и заберём деньги. Про риски не сказала. Подложила документы на подпись, уверив, что формальности, а там был документ, где пенсионерка доверила ей право подписи. Оператор наштамповала печатей на документах, которые не попали к матери даже, она их позже в конце в файлик подложила. Мама ушла ждать закрытия вклада и процентов. Выясняется, что через полгода можем забрать только свой один миллион, а второй миллион можем забрать только через 3 года3 мес так как куплены опифы, акции Роснефти, фьючерсные контракты и заведует миллионом ААА управление капиталом. Если хотите забрать раньше нужно заплатить 4 процента, ещё 1 процент за обслуживание и все это снимут от суммы, когда продадут данный товар и накуплено товара уже на 18 тыс, отчёта о купленном богатстве никто не предоставил, чеков нет, есть только приходник, что они взяли 2 млн этого первоначально никто не объяснил нам нужно покупать квартиру через 2 месяца, когда вклад должен был бы закрыться, но мы должны выкупить свои деньги у этого типа «МММ», чтоб ещё не ждать 3 года. Потери колосальные! Знала бы никогда не связалась с ними. Обидно то, что и через 3 года проценты не дадут, а дай бог отдадут назад побитый инфляцией без процентный миллион. Думаешь Газпром честные, а они так жадно и низко \*\*\*\*\* моих родителей пенсионеров. Пойду в Прокуратуру, буду писать в Роспотребнадзор, Центробанк. Был период охлаждения 14 дней и можно было вернуть назад столь «ценный» товар, но поздно спохватились и конечно же об этом не знали. В 2025 году банки будут сильно штрафовать за мисселинг, видимо хотят навариться успеть сейчас до 25 го года.;;;30.08.2024;1;sravni.ru;20573;Аноним None;Газпром безжалостен к старикам;Сбережения и накопления;neutral
Получил в банке карту для получения кэшбэка на заправках Газпромнефть. По рекламе кэшбэк должен быть 5%, реально ноль. Сотрудники допофиса информацией не владеют, включая руководителя допофиса. Компьютеры не работают, на вопросы ответить на могут. Даже не думал, что сейчас существуют такие банки! Про чат Газпромбанк вообще можно книги писать, специалисты по несколько часов не отвечают, а если ответят, то ничем помочь не могут или просят обратиться позже из-за высокой загрузки. В течение нескольких дней пытался получить ответ, не получилось. Обратился в допофис- тот же результат. Вывод: больше никаких контактов с данным банком.;;;29.08.2024;1;sravni.ru;20574;Александр Вишнягов;Ужасный банк;Другое;neutral
Не могу забрать деньги с текущего счета, просто не отдают, говорят программа не даёт, и полгода такая ситуация, написаны несколько заявлений, но безрезультатно. Сотрудники говорят что я прав, но ничего не могут сделать. Не храните деньги в этом банке, обратно можете не получить;;;29.08.2024;1;sravni.ru;20575;Макс None;Не отдают деньги;Другое;negative
"В мае появилась потребность в карте UnionPay (далее UP), по мониторив условия во всех банках (кто открывает UP), решил открыть в Газпромбанке, потмоу что них есть акция «Верните комиссию за выпуск карты». Оформив карту на сайте, через несколько дней девушка курьер привезла карту. По условиям возврата, за оформление карты 5000 руб. , В виде «кэшбека» девушка сказала, что самое простое условие это неснижаемый остаток 10000 рублей на балансе в течение 3 месяцев. Так и поступил, закинул туда 20000 рублей, чтобы наверняка. После пополнения со счета сразу списалось 5000 рублей за оформление карты.

Прошло 3 месяца, 5000 рублей не вернулись. Я написал в поддержку, чтобы узнать почему не пришел «кэшбек», на что получил ответ «Вы не выполнили условия акции». Якобы я получил карту 20.05, Пополнил ее 22.05, А надо было пополнить 20.05 Или 21.05. Хотя и девушка курьер, которая выдавала карту, ничего об этом не сказала, да даже на сайте про это нет ни слова. Создается такое впечатление, что прямо на месте выдумали правила, чтобы не выполнились условия акции";;;29.08.2024;1;sravni.ru;20576;Александр Шевчик;Газпромбанк и его «кэшбек» 5000р за карту UnionPay;Повседневные финансы и платежи;positive
27.04.2024 Оформил карту UnionPay. Для участия по возврату 5000 р. За выпуск карты положил 16000 р. На счёт в этот же день. 02.05 Сняли плату 5000 р. За выпуск карты. В течение 90 дней остаток на карте не опускался ниже 10000 р. Условия выполнены. В итоге кэшбэк не пришёл. Оператор в чате говорит, что зачисление 16000 р. Прошло только 2.05.2024, А надо не позже следующего дня после выпуска. История зачислений в ЛК подтверждает зачисление 27.04.2024. Ужас, серьезный банк вроде. Мало того что после обращения в банк постоянно начинаются звонки с рекламой, так ещё и сами клиентов \*\*\*\*\*. Больше ни ногой в этот банк.;;;29.08.2024;1;sravni.ru;20577;Евгений None;Банк ***** с кэшбэком! Впервые вижу такое​!;Повседневные финансы и платежи - Дебетовые карты;neutral
