text;topics;sentiments;date;rating;source;id;author;title;product_category;sentiment
"30 июля 2024 г. Подала заявку на дебетовую карту юнион пей Газпромбанка (карта нужна была для подстраховки в поездке за границу) карту банк одобрил, получение карты не в банке, а только официальным представителем, который привозит лично. Ну хорошо. Дату встречи назначили на 8 августа 2024. 8 Августа представитель банка приехала, выдала карту, сфотографировала меня и документы. Затем достала ещё один конверт с кредитной картой юнион пей, со словами, что при оформлении дебетовой карты, банк так же выдает еще и кредитную. На мои слова что мне кредитка не нужна, пользоваться ей я не собираюсь и я ее не оформляла, сотрудник ответил что она обязана мне ее выдать и точка, что карта не активирована, что я могу её не активировать, не создавать пин код и никаких списаний по ней не будет, ничего страшного не случиться если я ее получу, в будущем могу написать заявление на её отказ. После озвученых условий от представителя банка, что комиссия списывается только после активации карты и создания пин-кода-подписала документы. 9 Августа, зайдя в интернет банк увидела что по неактивированной кредитной карте банк списал комиссию 3490! Написала тут же представителю банка, которая выдавала мне карту, как оказалось- она вообще не в курсе, что банк списывает комиссию: пишет, что раньше ничего не списывали по картам, которые она выдавала. Это либо намеренная ложь, либо полная некомпетентность сотрудника банка. Это, повторюсь, официальный представитель банка, который обязан разъяснить все условия. В итоге карта не активирована и мне не нужна, долг 3490 на ней висит. Газпромбанк нагло н\*\*\*\*\*кредитные карты, списывает комиссии, а сотрудники банка о\*\*\*\*\* для того чтоб выдать карту клиенту.

Карту я получала у официального представителя банка, консультацию предоставлял он.

Карта была получена согласно информации, которая была им озвучена. И подтверждена им же позднее в переписке.

Переписку с предствителем банка, выдавшим карту и огласившим условия по ней могу предоставить.

Требую банк разобраться в ситуации, закрыть образовавшийся долг. Карта после этого будет мной закрыта, так как она изначально мне была не нужна, а была о\*\*\*\*\* \*\*\*\*\* дополнительно к дебетовой.";;;04.09.2024;1;sravni.ru;10198;Елена Латыпова;Банк и его сотрудники о***** клиентов, списывая о***** путем деньги!;Повседневные финансы и платежи - Мобильный банк;negative
"Самый отвратительный банк, с которым мне приходилось иметь дело.

27.04.2024 Г. Была оформлена карта UnionPay. Условием возврата комиссии в размере 5000 руб. За выпуск карты в виде кешбэка были или траты свыше 10000 руб. Ежемесячно в течение 3-х месяцев или неснижаемый остаток на карте свыше 10000 руб. В течение 90 дней (да, на тот момент были старые условия, не 50000 руб. , Как сейчас). Причем сотрудник банка, оформлявший карту, ни слова (!) Не сказал о том, что для получения кешбэка деньги в качестве неснижаемого остатка нужно внести на карту «вот прям щас», не отходя от кассы, иначе кешбэка не будет. Если бы данная информация была доведена до меня при получении карты, я бы положил требуемую сумму на карту сразу же, чернила на договоре не успели бы высохнуть. Что самое интересное, траты свыше 10000 руб. В месяц тоже не все учитываются. Оказалось, что есть куча MCC-кодов, по которым есть ограничения. В частности:

4812: Телекоммуникационное оборудование, включая продажу телефонов;

MCC-коды оплаты связи;

4900: Жилищно-коммунальные услуги;

6012: Финансовые учреждения — торговля и услуги;

7299: Различные услуги — нигде более не классифицированные; (самое вкусное)

7311: Рекламные услуги;

7399: Бизнес услуги — нигде более не классифицированные; (тоже вкусно)

9399: Государственные услуги — нигде более не классифицированные;

9402: Почтовые услуги — только государственные;

9754: Лошадиные / собачьи бега (только США). (Внезапно).

Что из этой полезной информации мне сообщил сотрудник банка? Ни-че-го! Зато рекламных буклетов напихали полную… пачку, аж конверт распух.

Что имеем в итоге? 3 Месяца деньги мертвым грузом пролежали на карте (причем за Привилегии каждый месяц аккуратно списывали по 199 руб.), Потом ждал еще месяц для начисления кешбэка, после неполучения которого начал разбираться, тут-то оно все и всплыло.

Техподдержка в чате отдельный вид искусства у данного банка. Вы можете писать сообщения, но на них в большинстве случае либо просто тупо не ответят либо спустя полчаса напишут что-то типа «Добрый день! Сейчас в чате скопилось много вопросов, поэтому мы не можем быстро помочь. Пожалуйста, напишите или позвоните нам позже, если ваш вопрос будет еще актуален. Приносим извинения за доставленные неудобства и надеемся на ваше понимание». Естественно, с таким подходом как не будет кучи скопившихся вопросов.

И в качестве вишенки на торте: сообщения из чата со временем просто исчезают. Захотели вы посмотреть, что вам ответила техподдержка (да, такое тоже бывает) месяц назад, а сообщений уже и след простыл. Удобно!

Выводы делайте сами. Лично я не рекомендую нести свои деньги в данное учреждение.";;;03.09.2024;1;sravni.ru;10199;Иван Рубцов;Отсутствие кешбэка за получение UnionPay;Повседневные финансы и платежи;neutral
"В середине июля оформляла дебетовую карту в Газпромбанке, чтобы открыть вклад. Сотрудник банка н\*\*\*\*\* мне кредитную карту, сказав, что без нее нельзя открыть дебетовую по спец акции.

Я хотела закрыть кредитную карту сразу, но сотрудник в офисе сказал, что это можно сделать только с 1 августа. 1 Августа я обратилась через чат в приложении и подписала заявление на закрытие карты.

Сейчас 2 сентября, а карта все еще висит в приложении со статусом «Скоро закроется» и припиской «Закроется 31 августа», в чате мне отвечает только бот, дозвониться в колл-центре я тоже не смогла, слишком большое время ожидания.

Прошу представителей банка объяснить почему в приложении все еще висит карта, закрыть ее, а также доработать бот, потому что на данный момент — это просто издевательство над пользователями";;;02.09.2024;1;sravni.ru;10200;Татьяна None;Не закрывается кредитная карта;Сбережения и накопления;positive
Александр К.- менеджер банка, а может быть \*\*\*\*\*. Позвонил, договорился со мной о встрече и изчез. На звоник не отвечает, на сообщения тоже. Позвонила в банк, там говорят, что его не знают, хотя его номер был указан в приложении банка. Покрывают своих не компетентных сотрудников. Позор, а не обслуживание. Как вы до такого уровня дошли? Самим то не стыдно работать в этом банке?;;;02.09.2024;1;sravni.ru;10201;Татьяна None;Позорный банк;Повседневные финансы и платежи - Дебетовые карты;positive
"Совершенно издевательское отношение к клиентам, позвонившим на горячую линию Газпромбанка. Вопрос: для чего она существует, если стандартный ответ среди белого дня и посреди ночи один и тот же: "" В связи с большим количеством обращений время ожидания увеличено». Далее сообщается, что время это составит 30 минут. По истечении 30-ти минут (проведён «эксперимент») неведомое их количество будет повторяться одна фраза: "" Время ожидания составляет одну минуту». И так до бесконечности, наверное.

Такого нет ни в одном банке, к услугам которых приходилось обращаться.";;;02.09.2024;2;sravni.ru;10202;Валентина None;Отвратительная работа горячей линии;Другое;positive
"21 марта 2024 года окрыла дебетовую карту Union Pay по акции «Кешбэк 5000 рублей при соблюдении условия: поддержание минимального остатка на карте 50 000 рублей в течение 3-х месяцев»

Выпускала карту для поездки в Дубай. Карту привез сотрудник банка в 21 марта в 17.05, Выдал карту и сказал, что после активации карты, необходимо ее пополнить, с карты будут списаны 5000 комиссия, которая будет возвращена при выполнеии условия остатка на карте 50 000 рублей.

Карту банк активировал 24 марта, до этого момента пополнить карту ни в банкомате, ни переводом было невозможно. Пыталась сделать и то, и другое, также писала в чат банка с просьбой активировать карту, т. К. Приближалась дата отъезда за границу и очень не хотелось остаться без карты в другой стране. 24 Матра после активации карты, сразу же пополнила ее на 55 000 рублей и 3 месяца держала неснижаемый остаток. Никакой информации от банка о невыполнении мною условий не поступало.

После выполнения всех условий и не дождавшись кешбэка, обратилась в чат банка (уровень операторов это отдельная история и большая потеря имиджа банка), мне сообщили, что я не выполнила условия акции, 50 000 рублей нужно было внести в день выдачи карты и все.

А как, простите, его выполнить, если банк не активировал карту в день ее выдачи?

На мой этот вопрос оператор банка ответил: Вы не выполнили условие.

Газпромбанк, не \*\*\*\*\* людей своими акциями, берите 5000 в открытую и по-честному, Вы в первой тройке и с госучастием, не ждешь такого от государства.";;;01.09.2024;1;sravni.ru;10203;Елена Стоналова;Газпромбанк не возвращает 5000 руб при открытии карты Union Pay!;Повседневные финансы и платежи;positive
"21.08.2024 Г. Я решила открыть накопительный счет в Газпромбанке. После подписания договора начались звонки из банка со странным вопросом: «Вы такая-то такая (ФИО)?» На мой вопрос: «Что вы хотите от ФИО? И вы поверите мне на слово, что я действительно ФИО? » В ответ получаю: «Вы не прошли верификацию, мы свяжемся с вами в другой раз». В чем смысл таких звонков? Как вы собираетесь верифицировать человека по телефону?!
27.08.2024 Я обратилась в банк для отзыва согласия на обработку персональных данных с целью предоставления рекламной информации об услугах и продуктах банка. Которые были подключены мне без моего согласия, меня об этом даже не спросили, сами наставили галочек, что я согласна на их получение. Но даже после этого звонки не прекратились. 31.08.2024 Г. Я решила не связываться с банком, который не выполняет требование клиента, и расторгнуть договор с банком.
Техподдерка банка это вообще что-то фееричное! Вам сообщают: «Уважаемый клиент, ожидаемое время до соединения со специалистом составляет 30 мин.» После ожидания обратного отсчета до 10 минут, звонок прерывается и можно начинать все сначала. О каком уважении к клиенту может идти речь, заставляя его столько ожидать, а потом еще и отключаться?";;;31.08.2024;1;sravni.ru;10204;Ирина Мозолева;Неуважение к клиентам;Повседневные финансы и платежи - Ведение валютных счетов;negative
Заказал дебетовую карту! Написали приезжайте, забирайте! Поехал забирать, в отделение в Питер! Почти приехал, звонит человек, я мол курьер, карта ваша у меня, но я вам её пока привезти не смогу, только часа через 3-4, хотя время встречи указано с 10-15. Я ему говорю, а смогу я такую карту сделать в вашем отделении любом, чтобы не слонятся в Питере! Он говорит конечно! Я прихожу в отделение, они меня по компу видят, вроде начинаем оформляться и наступают тех. , Проблемы. И оператор говорит извините ничего сделать не можем, как-то так. Вообщем долгая история, не советую этот банк!;;;31.08.2024;1;sravni.ru;10205;Аноним None;Всё печально!;Повседневные финансы и платежи;neutral
"Решил оформить через банк автокредит. Пообщался с оператором, узнал все условия — ок. Назначали встречу с курьером 29.08 На 30.08. Сказали, что сегодня со мной свяжется курьер для согласования времени встречи. 29.08 Никто так и не позвонил.

30.08 Звонок от курьера, сказал, что приедет в промежутке между 15:00 и 18:00. В 17:48 пришло смс, что по техничским причинам встреча отменена. В ближашайшее время мне позвонит сотрудник банка и назначит новую встречу. Далее звонок от того самого курьера и он мне сообщает, что с документами какая-то проюлема и мне нужно самому приехать в офис. С какими такими документами проблема, если я никакие документы не отправлял и задача курьера как раз эти документы проверить. Если ваш 1 курьер на весь город не справляется со своей работой — так и скажите. Что за каменный век? Ехать самому в банк, когда все ваши конкуренты выезжают на дом для решения подобных вопросов.

Так ладно еще бы сразу сказали, что нужно ехать. Тупо просидел и впустую прождал. Почему о пробелме с документами сказали именно за 12 минут до встречи? А что с ними было вчера и целйы день сегодня?

Ужасное впечатление о банке. А, ну и дозвониться до банка не так уж и легко. 30 Минут мне потребовалось, чтобы меня соединили с оператором. Много обращений? Это не проблема клиентов, нанимайте больше людей. Я не должен висеть на линии 20 минут, чтобы просто переговорить с оператором. Треэш какой-то, хуже сервиса я лично никогда не встречал. Оператор двух слов связать не смог, на вопросы ответа нет. Сперва переназначили встречу, потом я сказал, что где гарантия, что встреча снова не отменится в последний момент?

И вишенка на торте: я сказал, что курьер отменил встречу т. К у меня якобы какие-то проблемы с документами (которые я не отправлял). После чего оператор сказал, что тогда мне нужно самому ехать в банк. Классно. Оценка 0 из 10";;;30.08.2024;1;sravni.ru;10206;Сергей Сапаров;Ожидание на линии составляет 2 млрд лет;Повседневные финансы и платежи - Мобильный банк;negative
