text;topics;sentiments;date;rating;source;id;author;title;product_category;sentiment
"У меня 31 января заканчивается 2-й месяц накопительного счета. Я собирался 31-го положить эти деньги на другой счет, но в поддержке банка сказали, что если я 31-го сниму деньги (не закрывая счет), то мне не начислят проценты за весь январь. Поэтому снять можно только 1 февраля.

Т.е. один день или деньги будут лежать в ГПБ просто так, вернее с выгодой для банка.

А проценты за один день 670 руб., не такая и маленькая сумма.

Интересно, это у ГПБ сотрудники некомпетентные или это банк сознательно прикарманивает проценты за 1 день у каждого клиента банка?";;;29.01.2024;3;sravni.ru;10377;Станислав Морозов;ГПБ прикарманивает проценты за лишний день нахождения денег на накопительном счете;Повседневные финансы и платежи - Ведение валютных счетов;negative
"Эта статья написана на основе моего общения с ГазПромБанк на рейтинговой площадке

Первая часть - описание

Захотел я вторую карту ЮниоПей. Предстояло несколько командировок в Китай и я решил подстраховаться. Тем более, что обещали мили Аэрофлот Бонус. Заказал премиум карту ЮнионПей через сайт ГазПромБанка с доставкой в Таганроге. Карту мне не доставили, попытки дозвониться и получить обратную связь – ничего не дали.

Хотел заказать карту ЮнионПей в офисе в Москве, но оказалось, что так как уже выпустили мне ЮниоПей (хоть и потеряли), ее уже заказать нельзя. Я просил ее анулировать (это тоже не быстро), и решил получить премиум МИР от ГазПромБанка.

Единственное что у меня хорошо получилось с ГазПромБанк – заказать карту МИР – быстро и спокойно.

Получить карту МИР (премиум) я смог с трудностями: отстояв двойную очередь и получая все новые SMS о выдаче, так как сотрудники не знали, как выдать такую карту. С 5го раза им удалось выпустить мне карту. На вопрос о пин-коде, мне дали ответ: «Он должен был прийти в SMS, ….. а не пришел….., наверно в личном кабинете сможете установить». Такой премиум сервис меня очень удивил, и я решил не активировать карту МИР.

Так как удивление было очень большим, я решил поделиться этим на VC.RU и на другой площадке.

И был очень обрадован, оперативно получив сообщение от ГазПромБанка: «Взяли ваш вопрос в работу. Уточним информацию и вернемся с ответом.». Как потом оказалось, они специалисты, именно по быстрым ответам, которые не несут информацию.

Потом началась игра в поддавки в пользу ГазПромБанка, с перенесением моих отзывов с оценками в комментарии, и нулевая реальная реакция на отзывы.

У меня большой опыт взаимодействия с банками, с многими большими банками, и меня такая стратегия поведения сотрудников ГазПромБанка сильно удивила. Очень удивила.

Параллельно, везде реклама ГазПромБанка:

«Премиум карта ГазПромБанк для путешественников»

«Все преимущества премиальной UnionPay Diamond»

«3 мифа о карте UnionPay»

Для меня это странно, столько денег вкладывать в рекламу, а когда есть реальный клиент – он не нужен ГазПромБанку. Больше 20 попыток общения с ГазПромБанком, по разным каналам и только отписки или тишина.

И я понял. Лавры СБЕРБАНКА и других оптово/розничных банков, не дают спать высшему менеджменту ГазПромБанка. Им очень хочется иметь такой же крутой банк. Деньги у них есть, все денежные потоки ГазПрома, все физические лица ГазПрома и дочек на зарплатных проектах. Получение налогов РФ (я свои платил на счет налоговой в ГазПромБанке). Но хочется быть лучше, хочется как СБЕР. Если раньше они «копали картошку» - обслуживали предприятия по добыче и доставке голубого золота, то теперь они захотели развиться и вырасти на новые рынки.

Руководство решило привлечь физических лиц, не имеющих отношение к ГазПрому. Или «перейти на выращивание клубники». И начало вкладывать деньги в рекламу (посадку клубники), развитие клубничных полей и т.д.

Но, сотрудники ГазПромБанка как привыкли «копать картошку», так и копают. На полях с клубинкой – они усиленно «копают картошку». Я не знаю, им руководство не объяснило разницу между картошкой и клубникой? И не сказало, что теперь они выращивают и клубнику и картошку?

И последнее сообщение показало, что даже, когда они выкапывают клубнику – они верят, что это картошка – и что они выполняют план.

Я думаю, они теперь виноград начнут сажать. Это модно сейчас: винодельни… шато… Но сотрудники всё так-же будут копать картошку.";;;17.01.2024;1;sravni.ru;10378;Роман Журенко;ГазПромБанк. Маркетологи и руководство банка взяли курс на выращивание клубники, но ...;Повседневные финансы и платежи - Ведение валютных счетов;positive
"Являюсь клиентом банка 8,5 лет (все это время был ЗП клиентом). За много лет с банком не было никаких проблем, но потом как началось. В моем отношении банк попортил свою репутацию в куче разных аспектов.
Надо было заплатить счет по ЖКХ. Сканирую QR прилоежение мне выдает сумму 2800, при реальном сумме 3500. Другие банки нормально все определяли и выставли сумму 3500. По моему вопросу почему так мне сказали пук-пук ничего не знаем.
Система лояльности. Банк ввел новую систему лояльности теперь не рубли на карту падают, а баллы, которые либо конвертировать с коэф 0,8 либо компенсировать покупку 1 к 1. При компенсации покупки выяснилось, что у меня ни одной подходяшей операции не было. Я просмотрел документы программы лояльности, ничего полезного не нашел. Пишу в чат, спрашиваю, а какие покупки можно компенсировать, информациии на странице я не нашел, мне в чате кидают туже самую страницу, что я читал. Но мое негодование, что кинули бы еще ссылку на гугл, мне через 10 минут написали скудный набор МСС кодов, где можно компенсировать 1 к 1 покупки бонусами.
 Закрытие карт.
1. В приложении у меня отображалась 1 очень старая карта, которой давно не было. Я решил ее закрыть и закрыл без проблем. Так же у меня была карта, которой я перестал пользоваться, но она была активна и я решил ее закрыть буквально через минуту после закрытие предыдущей, но было написано уже сервис не доступен. И так на протяжении месяца. Сервис не доступен. Пишу в поддержку, говорю сервис не доступен, что делать, мне в чате говорят, ну у нас в приложении есть сервис по закрытию карт, расказать как им пользовать? Я сказал, что он не доступен еще в начале своего обращения. В итоге оператор что-то там сделала, пришел код для закрытия карты, но куда его надо было вписывать так и не сказали.
2. Когда я понял, что я все больше не собираюсь пользоваться стикером я решил его закрыть. Пишу в чат, если я закрою стикер, остановная карта не закроется? Мне сказали нет она тоже закроется. На мой вопрос, если я просто заблокирую стикер, то плата за него (50р) будет начислять будет или нет? Сказали что будет.
Кредиты.
1. Выдача персональный условий кредита хуже, чем стандарные условия. В приложении мне начали очень сильно пушить взять у них кредит. При этом в разделе с кредитом был выбор кредит на стандарных условиях и на персональных. Однако персональные условия (напомню я ЗП клиент 8,5 лет) при выборе абсолютно любых параметров выдавали зачения были хуще, чем стандарные условия по кредите. При моей жалобе почему так сказали пук-пук ничего не знаем. Хорошего дня. Однако через какое-то выбор персональных условий кредита убрали.
2. Уточнение условий кредита. Необходимо было уточнить как формируется страхования премия при взятии кредита. На мой вопрос почему страховка в предложении кредита стоит столько, что входит в 400к, почему аналогичная страховка у вашей же страховой стоит в разы дешевле я не получил ответа. Могу ли я лично оформить страховку и прийти в банк, то ставка будет снижена или нет, тоже не получил ответа. Только отфутболивание в страховую. 
3. Выдача крединой истории. Решил через банк сделать отчет о кредитной истории. Произвел оплату. Через пару минут прислали уведоение, что отчет отправили на почту, если он не пришел, то позвоните или придите в отделение. Через час ничего так и не пришло. Звоню. 10 минут бодаюсь голосовым помошником. Который только предлагал оформить кредитку или говорил, что не дать поговорить с оператором.
Пришлось пришлось схитрить через 5 секунд я говорил с оператом, который через 10 секунд меня отправил к нужному оператору, которой в грубой форме сказал да нам пообще побоку на тебя, позвони когда нибудь потом. Досвидания.";;;16.01.2024;1;sravni.ru;10379;Иван Гром;Моя лояльность к банку за полгода упала с самой высокой оценки до самой низкой;Повседневные финансы и платежи - Ведение валютных счетов;positive
"10.01.2024 г. на сайте заказала дебетовую карту. 11.01.2024 г. обратилась в отделение банка для получения заказанной ранее дебетовой карты. Карту выдали и сообщили, что для активации карты потребуется мобильное приложение, то есть активация не в банкомате, не у менеджера, а именно в приложении. Учитывая тот факт, что у меня ios и приложения Газпромбанк отсутсвует, менеджер сказала скачать приложение Millioner consulting. Находясь в отделении приложение установили и вместе с менеджером начали процесс активации. Активация подразумевает ввод телефона и данных карты (номер и CVV код). Данные ввели, но приложение сообщило что таких данных нет или не верно заполнено. Перепроверили, повторили попытку, результат тот же. После нескольких попыток меня заблокировали на 5 минут. Менеджер успокоила и сказала подождать и попробовать еще раз. На этом мы расстались. Через 5 минут повторила попытку, после этого меня заблокировали на 15 минут. По истечении 15 минут снова повторила попытку и заблокировали на 30 минут. Мое терпение было на грани. Я позвонила в контакт-центр, 10 минут ожидания и оператор на связи. Он сообщил, что мне надо подключить ""Мобильное информирование"", чтобы это не значило, и для этого нужно приехать в отделение банка! Серьезно! Моему возмущению не было предела! Я ехала в другой город за этой картой, поскольку в моем городе отделения нет, получила её, вернулась домой и давайте как еще раз приезжайте. На вопрос ""Почему так вышло"" поступил ответ ""Я не могу вам ответить на этот вопрос"". В процессе моих попыток Газпромбанк уже наподключал платных услуг, пришло смс об этом, а пользоваться картой я не могу. В банк конечно придется еще раз доехать, но для закрытия счета. Не рекомендую связываться с этим банком. Потратите время и нервы.";;;11.01.2024;1;sravni.ru;10380;Наталья None;Невозможно активировать дебетовую карту;Повседневные финансы и платежи - Мобильный банк;neutral
Здравствуйте!29.12.23 г был оформлен и выдан мне потребительский кредит , который отражается в приложении но договор на него не получил на почту и в приложении. Также как не видно самих денег со счётом в приложении, соответственно деньги не могу получить. В отделении банка 04.01.24 сказали что счет есть в Москве, а на горячей линии не могут отправить мне ни реквизиты ни договор и не видят счёт . Проценты по кредиту начисляются каждый день,а деньги не могу получить. Отвратительная работа персонала банка которые оформили кредит, персонал чата и горячей линии не отвечающих часами и переводящих на новых сотруднтков которые не могут никак разъяснить ситуацию и помочь в вопросе! На претензии нет никаких ответов, хотя приняты.Впервые связался с этим банком о чем очень жалею. Отвратительный банк, игнор клиентов, неквалифицированный персонал, отсутствие обратной связи и оформление продуктов для галочки без дальнешего сопровождения. Никому не советую связываться с Газпромбанком , если не хотите проблемы на свою голову, обходите стороной этот банк. Сотрудничаю со многими банками по разным банковским продуктам но такого ужаса не встречал нигде ещё!!!Почитайте другие отзывы и вы убедитесь что ужасный банк!;;;06.01.2024;1;sravni.ru;10381;Александр Егоров;Отвратительный банк!;Повседневные финансы и платежи - Ведение валютных счетов;negative
очень выгодные условия, процент начисляют вовремя, гибкая система начисления процента (чем больше положите денежных средств,тем больше процент, и в тоже время можно положить минимальныую сумму что бы не потерять денежный процент) минимальный обязательный платёж;;;01.01.2024;5;sravni.ru;10382;Полина None;накопительный счёт;Повседневные финансы и платежи - Переводы;neutral
Негативный опыт похода в офис банка в Колпино. Дебетовую карту я, так и не получил, хотя она была уже готова (если верить смс-ке из банка). Более 40 минут пришлось потерять времени в ожидании обслуживания.;;;11.02.2025;1;sravni.ru;20382;Пользователь None;Обслуживание клиентов на нуле.;Повседневные финансы и платежи - Мобильный банк;positive
"5 декабря 2024 я оставил в офисе банка 2 запроса, и один запрос через тех поддержку, 9 февраля я получил ответ на один из своих запросов и тот не работает. При официальном времени выполнения запроса 30 дней, мой продлевали несколько раз и наконец через 2 месяца и 4 дня ответил. Меня кажется разбаловала тех поддержка Сбера которая решает вопросы в течении нескольких часов.

Запросы:

1. запросил предоставить как начислялись тревел милли за 2 месяца — проигнорировали
2. заменить номер телефона на сайте gpbtravel. RU (Там отслеживается начисление тревел миль в ГПБ) До этого долго пытался это сделать онлайн, сотрудники банка как обычно полная некомпетентность, а сотрудники one-to-treap через которых и работает «gpbtravel. ru»  Сказали что они поменяют по запросу банка. Написал запрос ждал 2 месяца, ответ банка — предлагают менять в приложении, а в приложении не меняется, снова тех поддержка one-to-treap (вот кто реально молодцы, быстро отвечают), а поменять телефон можно только по запросу банка.
3. Попросил через чат заменить личного менеджера, сказали поменяют. Ну вы поняли проигнорировали. А почему попросил поменять, просто по моему опыту общения со Сбером, личный менеджер это человек который решает твои вопросы в банке чтобы ты туда не ходил. А в ГПБ это просто фамилия человека, который даже не отвечает на твои письма.

А забыл упомянуть, у меня примемиум обслуживание в ГПБ.";;;10.02.2025;1;sravni.ru;20383;Сергей None;Отвратительное обслуживание;Повседневные финансы и платежи - Дебетовые карты;neutral
Акция 35% на всё. Уточнял 100 раз. Засчитываются покупки в календарный месяц. По многим категориям. Календарный месяц — это с 1 по 30 число. Так мне объяснили в банке. По другому и быть не может.  Баллы не начислили за декабрь. Покупка в Дикси — супермаркет по счёту бы ла 29 декабря. Оказлаось они извращаются. Покупка — это не день когда вы что-то купили. А когда завершилась транзакция. Это до 7 дней. То есть вы можете купить товар 24 числа. А засчитают его, как покупка следующего месяца. Так как покупка длилась С 24 по 1 число. Это наглый об\*\*\* и м\*\*\*\*\*\*\*. В отношении клиентов банка.;;;09.02.2025;1;sravni.ru;20384;Владимир None;О****** клиентов.;Другое;positive
